{
  "project_code": "OSS-BLIND",
  "work_item_id": "CHATWOOT-15768",
  "manifest_type": "requirement_source_manifest",
  "summary_artifact": "inputs/requirement_summary.md",
  "sources": [
    {
      "source_id": "SRC-001",
      "source_type": "public_doc",
      "location": "https://github.com/chatwoot/chatwoot/pull/15768",
      "status": "available",
      "retrieved_at": "2026-09-21",
      "notes": "PR description and merge metadata; diff excluded from blind input"
    },
    {
      "source_id": "SRC-002",
      "source_type": "public_doc",
      "location": "https://github.com/chatwoot/chatwoot/issues/15767",
      "status": "available",
      "retrieved_at": "2026-09-21",
      "notes": "Count/list divergence context; inbox ID fix remains outside this PR scope"
    },
    {
      "source_id": "SRC-003",
      "source_type": "local_file",
      "location": "inputs/public_source_snapshot.md",
      "status": "available",
      "local_artifact": "inputs/public_source_snapshot.md",
      "retrieved_at": "2026-09-21",
      "notes": "Frozen public-input snapshot with oracle boundary"
    }
  ],
  "unresolved_sources": []
}
