{
  "project_code": "OSS-BLIND-R3",
  "work_item_id": "SUPABASE-50569",
  "manifest_type": "requirement_source_manifest",
  "summary_artifact": "inputs/requirement_summary.md",
  "sources": [
    {
      "source_id": "SRC-001",
      "source_type": "public_doc",
      "location": "https://github.com/supabase/supabase/pull/50569",
      "status": "available",
      "retrieved_at": "2026-09-21",
      "notes": "Author-written feature description and merge metadata; automated summary, diff and tests excluded"
    },
    {
      "source_id": "SRC-002",
      "source_type": "local_file",
      "location": "inputs/public_source_snapshot.md",
      "status": "available",
      "local_artifact": "inputs/public_source_snapshot.md",
      "retrieved_at": "2026-09-21",
      "notes": "Frozen blind-input snapshot with oracle boundary"
    }
  ],
  "unresolved_sources": []
}
