{
  "project_code": "OSS-BLIND-R4",
  "work_item_id": "KUBERNETES-141831",
  "manifest_type": "requirement_source_manifest",
  "summary_artifact": "inputs/requirement_summary.md",
  "sources": [
    {
      "source_id": "SRC-001",
      "source_type": "public_doc",
      "location": "https://github.com/kubernetes/kubernetes/pull/141831",
      "status": "available",
      "retrieved_at": "2026-09-22",
      "notes": "PR description and merge metadata only; diff, hooks, tests and live verification excluded"
    },
    {
      "source_id": "SRC-002",
      "source_type": "local_file",
      "location": "inputs/public_source_snapshot.md",
      "status": "available",
      "local_artifact": "inputs/public_source_snapshot.md",
      "retrieved_at": "2026-09-22",
      "notes": "Frozen behavioral snapshot with Oracle boundary"
    }
  ],
  "unresolved_sources": []
}
