{
  "project_code": "OSS-BLIND-R3",
  "work_item_id": "DJANGO-21801",
  "manifest_type": "requirement_source_manifest",
  "summary_artifact": "inputs/requirement_summary.md",
  "sources": [
    {
      "source_id": "SRC-001",
      "source_type": "public_doc",
      "location": "https://github.com/django/django/pull/21801",
      "status": "available",
      "retrieved_at": "2026-09-21",
      "notes": "PR title, description and merge metadata only; diff and tests excluded"
    },
    {
      "source_id": "SRC-002",
      "source_type": "public_doc",
      "location": "https://code.djangoproject.com/ticket/37286",
      "status": "available",
      "retrieved_at": "2026-09-21",
      "notes": "Primary public bug description and expected migration behavior"
    },
    {
      "source_id": "SRC-003",
      "source_type": "local_file",
      "location": "inputs/public_source_snapshot.md",
      "status": "available",
      "local_artifact": "inputs/public_source_snapshot.md",
      "retrieved_at": "2026-09-21",
      "notes": "Frozen blind-input snapshot with oracle boundary"
    }
  ],
  "unresolved_sources": []
}
