{
  "project_code": "OSS-BLIND-R3",
  "work_item_id": "CELERY-10668",
  "manifest_type": "requirement_source_manifest",
  "summary_artifact": "inputs/requirement_summary.md",
  "sources": [
    {
      "source_id": "SRC-001",
      "source_type": "public_doc",
      "location": "https://github.com/celery/celery/pull/10668",
      "status": "available",
      "retrieved_at": "2026-09-21",
      "notes": "PR description and merge metadata; diff and listed tests excluded from generation input"
    },
    {
      "source_id": "SRC-002",
      "source_type": "public_doc",
      "location": "https://github.com/celery/celery/issues/4300",
      "status": "available",
      "retrieved_at": "2026-09-21",
      "notes": "Linked public issue used only for problem context already summarized by the PR"
    },
    {
      "source_id": "SRC-003",
      "source_type": "local_file",
      "location": "inputs/public_source_snapshot.md",
      "status": "available",
      "local_artifact": "inputs/public_source_snapshot.md",
      "retrieved_at": "2026-09-21",
      "notes": "Frozen blind-input snapshot with oracle boundary"
    }
  ],
  "unresolved_sources": []
}
